"film_id","langue_code","resume"
"638c595e-3252-4247-873c-0618d0be9b3c",fra,"La course du Cannonball déclarée illégale par les autorités a bien failli ne pas avoir lieu, la police ayant arrêtée tous les participants la veille du départ ! Mais de nouvelles recrues ont su prendre le relai sur le champ. De Washington à Los Angeles toutes les forces de police sont en alerte pour cette nouvelle course effrénée et mouvementée de 6000 kilomètres au cours de laquelle tous les coups sont permis ..."
"05f440f3-8cc0-4913-a582-c106ed3b7ddb",fra,"Miriam est une femme-vampire née en Egypte il y a 4000 ans. Elle possède le don de l'immortalité et de la jeunesse. Elle vit désormais à New York, avec son compagnon John depuis 300 ans. John est alors frappé d'un processus accéléré de vieillissement. Afin de tenter de le sauver, Miriam rencontre la séduisante Sarah, docteur spécialiste des mécanismes du vieillissement, sur laquelle elle jette son dévolu..."
"2f179d29-3ffe-4e7b-864e-785a13a12663",fra,"L’an 2274. En apparence, le Sanctuaire est un véritable paradis. Ses habitants, néanmoins, n’ont pas le droit d’en sortir. Ceux qui ont l’audace d’aller voir ailleurs sont systématiquement traqués et supprimés. De plus, une sorte de malédiction condamne la population à mourir à l’âge de 30 ans. Les citoyens qui atteignent cet âge sont éliminés au rayon laser. On parle d’une sélection qui permettrait à certains de renaître, mais nul n’est là pour en témoigner. Aussi les moins dociles préfèrent‐ils prendre la fuite avant le jour fatal. Logan est de ceux‐là. Cédant à la curiosité, il s’échappe un jour de la cité pour voir à quoi ressemble ce vaste monde qu’on lui cache depuis sa naissance…"
c14bdfce-1acd-4b00-bbc3-55d386496f69,fra,"En 1985, soit 20 ans après la fin de la première série, Raymond Burr reprend son rôle d'avocat, toujours accompagné de sa fidèle assistante Della Street. Il se fait aider dans ses enquêtes par Paul Drake Jr, le fils du détective Paul Drake puis par Ken Malansky..."
de07a484-7e0a-4501-a9ea-99c4d65a42de,fra,"Echappé de prison, Bobby retourne dans sa ville natale au sud des Etats-Unis pour régler quelques comptes. Certaines personnes à la conscience peu tranquille vont le traquer."
"3cc31958-dcfa-4b1c-bcea-370175324d3a",fra,"En l’an 40 000. Sur ordre du président de la Terre, la jeune Barbarella doit retarder ses vacances sur Vénus pour tenter de retrouver et d’arrêter le redoutable professeur Durand Durand, qui vient de mettre au point une arme effroyable : le rayon positronique, aussi appelé « polyrayon 4 », qui met en danger l’équilibre de l’amour universel. Un atterrissage forcé sur Lytheion vaut à Barbarella d’être capturée par deux gamines qui la livrent à des poupées‐robots. La jeune femme est sauvée par l’intervention de Mark Hand. Elle apprend en outre que Durand Durand se trouve sur la planète Sogo, sur laquelle son appareil s’écrase. La malheureuse tombe entre les griffes de la féroce Reine noire…"
b35feee2-de5e-461f-a61d-1334fd464bdb,fra,"Ensorcelés par le cruel et jaloux évêque d'Avila, les amants Etienne de Navarre et Isabeau d'Anjou se tranforment alternativement en loup et en faucon. Avec le secours de Philippe Gaston, jeune voleur qu'ils prennent comme messager, et du vieux moine Imperius, ils se lancent dans une quête pour combattre le diabolique homme d'église et retrouver leur forme originelle."
