"film_id","langue_code","resume"
d8e8472a-a08d-4c0a-a68f-9c058a83dc27,fra,"Après avoir purgé une peine légère, Frank Leone est sur le point de quitter la prison. Mais Drumgoole, le gardien de l'établissement humilié dans le passé par Frank Leone, entend ne pas laisser sortir son prisonnier si facilement."
"4dafc2bb-39bd-4cc7-ad8a-76e74f377aeb",fra,"Dans les quartiers populaires de Philadelphie, Rocky Balboa collecte des dettes non payées pour Tony Gazzo, un usurier, et dispute de temps à autre, pour quelques dizaines de dollars, des combats de boxe sous l'appellation de 'l'étalon italien'. Déçu de le voir gâcher son talent, son entraîneur Mickey le laisse tomber, tandis qu'Apollo Creed, champion en titre, cherche un nouveau challenger..."
"2efc6f4f-82cb-4a25-9143-7d6507f14438",fra,"Seth Brundle est un jeune biologiste très doué. Après avoir fait ses premières armes dans une brillante équipe, il se décide à travailler seul. Il met au point une invention qui doit révolutionner le monde : la téléportation qui consiste à transporter la matière à travers l'espace. Les essais sur un babouin sont peu convaincants et après des fuites dans la presse, il décide de se téléporter lui-même. Seulement il ne s'apercoit pas qu'une mouche fait partie du voyage."
"27737bdf-de50-4367-a306-6fdef9af881e",fra,"Une toute jeune fille romantique se sentant mal à l’aise dans sa famille s’évade en lisant des contes fantastiques. Son livre favori « le Labyrinthe » lui ouvre une nuit les portes d’un autre monde. Sarah voit son jeune frère, Toby, enlevé par une troupe de lutins aux ordres du séduisant et cruel Jareth. Elle part au secours de l’enfant et pénètre dans le labyrinthe qui mène au palais du ravisseur. « Labyrinthe est à la fois un récit d’aventures et une plongée dans les rêves et les sentiments d’une jeune fille au seuil de la maturité. »"
"9da54652-3655-4cc3-87ce-8e3e4a5d36f5",fra,"Faisant équipe avec Kalidor, un valeureux guerrier, Red Sonja souhaite venger la mort de ses parents tués par la reine Gedren et mettre fin à son désir de conquérir le monde grâce aux pouvoirs d’un talisman."
"2498a617-cc8d-4ef0-81a4-c992339c957f",fra,Un groupe de jeunes découvre par hasard un cylindre contenant un cadavre en décomposition et répand accidentellement dans l'air le 2-4-5 Trioxen. Ce gaz redonne vie aux habitants du cimetière avoisinant...
"8a121e62-10bc-4dfd-a741-7dd440c467de",fra,"Dans le but de retrouver son père, célèbre professeur d'archéologie disparu depuis des mois, la belle Jesse Huston fait appel à Allan Quatermain, un intrépide aventurier."
"6da1aacb-3ad5-451a-8314-423bcd8b9209",fra,"Cinq jeunes vacanciers s’installent dans une baraque au cœur d’une sinistre forêt. En descendant dans une cave lugubre, les deux garçons de la bande découvrent un vieux magnétophone qui une fois remis en marche, émet une incantation magique. Laquelle réveille les forces du mal, déclenchant ainsi une horreur sans nom…"
"414ad9e5-b970-4595-8f6c-44ade63b38fc",fra,"Max, de retour, s'est fait dépouiller de son maigre bien. Suivant le voleur, il arrive à la Ville du Troc, où règne Entity. Celle-ci l'engage pour qu'il la débarrasse de Master et Blaster, rois du Monde souterrain. N'ayant voulu tuer Blaster, Max est abandonné en plein désert, d'où il ressurgit à la tête d'une troupe d'enfants pour faire exploser la Ville du Troc."
b43b7e4f-3e71-45a0-b55e-2b5b82ccae70,fra,"Charlie Brewster est un adolescent sans histoire. Il partage sa vie entre sa mère, sa petite amie, ses copains et ses séries préférées à la télévision sur les films d'horreur de série B. Tout va être bouleversé lorsqu'il va découvrir que son nouveau et séduisant voisin est un monsieur qui a les dents longues… Qui va croire Charley ?"
"629a01e7-1e63-407a-b2cd-04ad16438f47",fra,"Deux cents ans après le lancement de la dernière bombe atomique, un groupe de personnes affamées s'introduit dans un bâtiment d'une ville abandonnée. Le groupe est alors attaqué par des rats géants et également affamés..."
"695fb599-9b9f-481e-9f62-ce52dddf918c",fra,"Les nouvelles aventures d'Allan Quatermain et de Jessie Huston , désormais sa compagne. Alors qu'il s'apprêtent à partir aux Etats-Unis pour se marier, un homme grièvement blessé surgit. Allan recueille alors les confessions du mourant..."
"412db3da-061b-4b62-9015-00649a08eb45",fra,"John Rambo purge une peine de prison lorsque le Colonel Trautman lui donne la possibilité de sortir pour une mission délicate : avoir la preuve qu'il reste bel et bien des prisonniers américains au Vietnam.Supposé n'être qu'un observateur, Rambo désobéit aux ordres et tente de sauver un prisonnier. Murdock, le responsable de la mission, décide alors de l'abandonner en territoire ennemi, Rambo, seul, sans armes et face à l'ennemi, prépare sa vengeance et son retour au pays."
"0ae82a80-bedc-4bc2-b6d7-d7eaab3d8bac",fra,"Exaspérée par les priorités professionnelles de son mari, Joanna Kramer quitte son mari Ted et leur fils Billy. Le père doit alors concilier l'éducation de son fils et son travail de publicitaire mais parvient à tisser une relation très forte avec Billy. Quelques mois plus tard, Joanna est de retour et entame une procédure judiciaire pour obtenir la garde de l'enfant."
"0ae7f4b9-cd5d-4740-ab4b-24d5faeac626",fra,"Nick Curran, inspecteur de police à San Francisco, enquête sur le meurtre d'une star du rock, Johnny Boz, tué de trente et un coups de pic à glace par une inconnue alors qu'il faisait l'amour. Nick apprend que le chanteur fréquentait Catherine Tramell, riche et brillante romancière. Au cours de son enquête, il s'aperçoit que les parents de Catherine sont morts dans un accident suspect, que son professeur de psychologie a été assassiné dix ans plus tôt à coups de pic à glace et qu'enfin, une de ses meilleures amies a, en 1956, tué ses trois enfants et son mari."
af80d4cc-e34a-48d0-85ed-a1227216eb88,fra,"Le Major Cabot organise des agressions et en accuse les Indiens afin de leur voler leurs biens. Joe Mercy, vit de l'argent que lui rapporte sa participation à des duels spectaculaires. Avec l'aide de Locomotive et de Lucy, il décide de dérober à Cabot les 300 000 dollars que ce dernier doit remettre au Général Penbroke..."
"46b5ed45-a5bd-4f51-8f0a-54e647ebc7ce",fra,"Morlar est un être étrange, apparemment immortel. Tous ceux qui lui causent du tort meurent mystérieusement. Il prétend également détenir des pouvoirs paranormaux et devant l'incrédulité des médecins et de la police, décide de le prouver en provoquant une catastrophe aérienne."
"22038333-cf97-4ff0-bb8c-1c418370f2a8",fra,"Il y a 15 ans, dans une petite ville des États-Unis, le soir d’Halloween, au cours de laquelle les enfants ont l’habitude de se déguiser, un petit garçon, Michael, épie sa sœur et son ami qui flirtent. Michael les suit et, armé d’un couteau de cuisine, assassine la jeune fille. Quinze ans plus tard, un psychiatre, le docteur Loomis qui étudie le cas du jeune meurtrier apprend que le criminel s’est échappé : il est revenu sur les lieux de son crime pour continuer son œuvre…"
"24c952a2-3133-4767-86f5-e0082341b124",fra,"Apprenant que sa femme Barbara, une riche héritière, a été kidnappée, Sam Stone n'envisage pas de payer la rançon."
ace1de16-80cc-4094-b70a-94401c7d049e,fra,"1936. Parti à la recherche d’une idole sacrée en pleine jungle péruvienne, l’aventurier Indiana Jones échappe de justesse à une embuscade tendue par son plus coriace adversaire: le Français René Belloq. Revenu à la vie civile à son poste de professeur universitaire d’archéologie, il est mandaté par les services secrets et par son ami Marcus Brody, conservateur du National Museum de Washington, pour mettre la main sur le Médaillon de Râ, en possession de son ancienne amante Marion Ravenwood, désormais tenancière d’un bar au Tibet. Cet artefact égyptien serait en effet un premier pas sur le chemin de l’Arche d’Alliance, celle‐là même où Moïse conserva les Dix Commandements. Une pièce historique aux pouvoir inimaginables dont Hitler cherche à s’emparer."
"6d02e5b2-c17b-4d89-9f7c-c626136f0a57",fra,"Crocodile Dundee alias Michael J. est un aventurier qui hante les vastes étendues du Bush australien : repas de lézards, larves et fourmis, rencontres inopinées avec des serpents et crocodiles… Élevé par une tribu d’aborigènes, il « zone » dans ces terrifiantes contrées comme un poisson dans l’eau. Sue Charlton, ambitieuse journaliste américaine, découvre l’homme sauvage et veut à tout prix faire un scoop. Elle finit par le rencontrer, l’emmène à New York, succombe à ses charmes et le suit pour le meilleur et pour le pire…"
b9eaf0c7-062e-4a1c-8431-f51b31088290,fra,"Dans ce film, Burt Reynolds est un aventurier qui décide de participer à une course de voiture illégale à travers tout le pays. Leurs coureurs devront tout faire pour surmonter les difficultés (y compris la police) et gagner la course."
"80c07340-a069-476a-a0a0-2460dc69b3cc",fra,"Les aventures du baroudeur Jack Burton à Chinatown, où règne le terrible sorcier Lo Pan. Celui-ci pense pouvoir retrouver son enveloppe charnelle grâce aux beaux yeux verts de Miao Yin, délicieuse Chinoise fiancée à un ami de Jack…"
e8f50c9e-8e3c-4b73-9e92-562bf984113a,fra,"Deux employés d'un entrepôt de produits médicaux libèrent par inadvertance un gaz toxique ramenant un mort à la vie. Pour se débarrasser de ce cadavre réanimé, ils l'incinèrent. Malheureusement, le nuage de fumée crée une pluie étrange qui s'abat sur le cimetière voisin..."
"7abca311-7572-49bb-8565-e3648fcb1989",fra,"Jeff Lebowski, prénommé le Duc, est un paresseux qui passe son temps à boire des coups avec son copain Walter et à jouer au bowling, jeu dont il est fanatique. Un jour deux malfrats le passent à tabac. Il semblerait qu’un certain Jackie Treehorn veuille récupérer une somme d’argent que lui doit la femme de Jeff. Seulement Lebowski n’est pas marié. C’est une méprise, le Lebowski recherché est un millionnaire de Pasadena. Le Duc part alors en quête d’un dédommagement auprès de son richissime homonyme…"
e4e5143d-c8b6-44ae-8d83-0699c1fb9272,fra,"Deux frères, Stephen et Brian McCaffrey, se destinent au métier de pompiers après avoir assisté à la mort tragique de leur père, officier d'élite de la 17e caserne des sapeurs-pompiers de Chicago. Vingt ans plus tard, si Stephen est devenu un pompier émérite, Brian vit de petits boulots. De retour à Chicago, il décide néanmoins de reprendre son entrainement sous l’œil sceptique de son frère.Mais celui-ci doit également se concentrer sur une nouvelle vague d'incidents criminels qui frappent la ville : des flammes éclairs, des backdraft, ces incendies qui s'éteignent d'eux-mêmes dans le propre souffle de leur explosion, terrassent un à un d'anciens collaborateurs du maire..."
"84ed3f64-88ea-4e96-a670-0f3095ececf2",fra,"Deux flics que tout oppose sont victimes d'une machination fomentée par un baron de la drogue. Pour se disculper, ils doivent mettre fin aux activités du trafiquant."
"6277443a-d0cc-4c54-bcde-3f43c896503d",fra,"Phil Connors, présentateur météo grincheux et arrogant, doit tourner un reportage sur la fête de la marmotte. Mais lorsqu'il se réveille le lendemain, il découvre avec stupeur que la date n'a pas changé et qu'il est condamné à revivre un par un les événements de la veille. Connors se voit dès lors obligé de faire face à la répétition infinie du Jour de la marmotte."
"6076c30d-c5ab-4e95-971a-425f2f4aa075",fra,"Un psychopathe connu sous le nom de Buffalo Bill sème la terreur dans le Middle West en kidnappant et en assassinant de jeunes femmes. Clarice Starling, une jeune agent du FBI, est chargée d’interroger l’ex‐psychiatre Hannibal Lecter. Psychopathe redoutablement intelligent et porté sur le cannibalisme, Lecter est capable de lui fournir des informations concernant Buffalo Bill ainsi que son portrait psychologique. Mais il n’accepte de l’aider qu’en échange d’informations sur la vie privée de la jeune femme. Entre eux s’établit un lien de fascination et de répulsion."
bd4537b9-afdc-494d-ac70-76cab133fa4c,fra,"Tout va mal pour nos deux héros. S’il ne veut pas finir en prison, Jack le flic, doit trouver rapidement le dangereux malfrat Iceman. Quant à Reggie, le voyou, il finit un séjour derrière les barreaux. Et Iceman a mis sa tête à prix. Pour preuve, l’autobus qui l’éloigne du pénitencier est attaqué et fait dix‐sept tonneaux avant de s’arrêter. A contrecoeur, Reggie s’allie à Jack pour 48 heures de plus…"
eb4c69f6-9fa5-4eb7-9a16-0259a9eac719,fra,"En 1985, Marty, un adolescent comme les autres, mène une existence morne et ennuyeuse. Heureusement, il est épris de la jolie Jennifer et entretient une profonde amitié avec Doc, un savant fou qui prétend avoir inventé une machine à explorer le temps. Un jour, Doc invite Marty à l'essayer..."
ca94860d-56c2-4b68-ac00-6d48d0de8ee4,fra,"Le Major Dutch Schaefer et son équipe sont envoyés dans la jungle sud-américaine avec pour mission de délivrer des alliés pris en otage par une bande de guérilleros. Mais pendant l'opération, Dutsch et ses hommes s'aperçoivent que les preneurs d'otages ont été... dépecés et suspendus à la plus haute cime des arbres. Très vite, le commando comprend qu'il a en face de lui un ennemi hors du commun. Un monstre invisible et indestructible venu d'une autre planète. Un extraterrestre rompu à toutes les formes d'attaques et qui ne poursuit qu'un seul but : la chasse à l'être humain. Schaefer et sa troupe sont pour lui du gibier de premier choix."
"9b4a8296-c6fe-40c6-b1c5-9807b2004976",fra,"Chauffeur routier solitaire, Lincoln Hawk est rongé par un divorce et par la culpabilité d'avoir abandonné un fils Michael qu'il n'a jamais vu. Lorsque Lincoln, sur les conseils de son ex-femme, part chercher son fils à l'Académie Militaire, il se cogne à l'agressivité de ce dernier. Pour Lincoln, le seul moyen de prouver à son fils, et à lui-même, qui il est réellement, c'est de remporter le championnat du monde de bras de fer de Las Vegas !"
dc18e978-7d17-4d05-ac8e-678a609fbcc7,fra,"Des séquelles physiques irréversibles amènent Rocky Balboa à prendre sa retraite. Ruiné, il devient l'entraîneur d'un champion en devenir, Tommy Gunn. Mais celui-ci ne va pas rester insensible à l'appât du gain et va quitter Rocky pour rejoindre les rangs d'un coach plus fortuné."
"6e76b203-3e19-4f72-9980-92752d48809a",fra,"Jeune as du pilotage et tête brûlée d'une école réservée à l'élite de l'Aéronavale américaine, la fameuse « Top Gun », Pete Mitchell, dit Maverick, tombe sous le charme d'une instructrice alors qu'il est en compétition pour le titre du meilleur pilote…"
"8a973d17-fccf-4240-8157-573db91eaa6c",fra,"Apollo Creed, ancien adversaire et dorénavant ami de Rocky Balboa, est tué sur le ring par le boxeur russe Ivan Drago. Se reprochant de n'avoir pu sauver son camarade à temps, Rocky va demander un combat contre Ivan Drago afin de le venger. Une confrontation qui se déroulera sur le sol russe."
cb500bc6-ef03-4205-86fe-33d0c6d2ec11,fra,"Un jeune curieux s'installe à Salem, où il a du mal à s'intégrer avant de réveiller un trio de sorcières diaboliques qui ont été exécutées au 17ème siècle."
"0855b28a-f73d-4302-8d48-2a2353d08321",fra,"Axel Foley est de retour à Beverly Hills. Cette fois, il vient prêter main forte à ses collègues et amis pour résoudre une affaire de vol de bijoux."
eaf58060-210e-465a-92e4-eed803451813,fra,"Auteur de romans d'horreur et vétéran de la Guerre du Vietnam, Roger Cobb s'installe dans un vieille demeure léguée par sa tante. Mais il est très vite poursuivi par armée de fantômes dirigé par Ben, un ancien du Vietnam abandonné par Roger."
e90836cf-cc5f-477d-9ca1-a44f1bd95abf,fra,"Le Colonel Trautman contacte Rambo dans sa retraite en Thaïlande pour qu'il l'accompagne dans une mission périlleuse en Afghanistan. Mais l'ex-soldat refuse afin de se consacrer aux moines bouddhistes qui l'ont recueilli. Lorsque, quelques jours plus tard, l'agent Griggs lui explique que Trautman a été capturé par le Colonel Zaysen, Rambo décide de sauver son ami. Il s'infiltre dans les lignes ennemies et découvre toute l'horreur du conflit qui oppose les moudjahidin à l'armée soviétique. Déterminé, il s'attaque à toute une armée sans oublier son objectif premier : récupérer Trautman."
"520d36be-24be-4e74-857d-c27b2f9e1f83",fra,"À l'aube de l'an 2000, Détroit est, comme toujours dans cette sorte d'histoire, la proie du crime et de la corruption. Pour pallier ce terrible état, les services de police inventent une nouvelle arme infaillible, Robocop, mi-homme, mi-robot, policier électronique de chair et d'acier qui a pour mission de sauvegarder la tranquillité de la ville. Mais comme souvent, ce cyborg a aussi une âme."
"2ed1d67e-a806-4e35-b625-ca2b029e366c",fra,L'université d'Arkham accueille un nouvel élève en médecine en la personne d'Herbert West. Celui-ci veut redonner vie aux morts...
a09cc505-1e03-49ec-9500-63478944a532,fra,"Un groupe de vingt personnes arrive exténué dans un club situé en Afrique pour passer quelques jours de repos. Et ils sont bien décidés à rentabiliser au maximum leurs vacances. C’est ainsi que nous suivrons les aventures tragi‐comiques de la colérique Nathalie, de Gigi, de Jérôme le sûr‐de‐lui, Christiane, le malchanceux Jean‐Claude, et bien‐sûr celles des G.O. (gentils organisateurs). Nouvelles rencontres, liaisons momentanées, petits et grands drames seront au programme…"
"43cf3e92-abba-4b8a-aaeb-b9b124458ea3",fra,"Vada Sultenfuss pourrait être une petite fille brillante et dynamique de 11 ans, mais avec sa mère morte en couches et son père Harry entrepreneur de pompes funèbres que plus rien n'intéresse depuis, Vania est complètement obsedée par la mort. Et l'arrivée de Shelly, une esthéticienne pour cadavres, dont Harry va peu à peu tomber amoureux, ne lui plaît pas d'avantage..."
bb73a806-7713-47b3-8355-b4151511a743,fra,"Les krits, aliens en forme de boules de poils, aux dents acérées et criminels intergalactiques, réussissent à s'évader de leur prison de l'espace à bord d'un vaisseau spatial. A leurs trousses, deux chasseurs de prime extra-terrestres qui ont la faculté de changer de visage. Tout ce petit monde atterrit dans le Kansas, non loin de la ferme de la famille Brow. Leur première victime : une vache. Mais peu à peu, ils vont prendre goût à la chair humaine."
"4d53ce95-43bf-4cfa-9f09-4f1520a006ed",fra,"Un orage magnétique déclenche à nouveau l'horreur sur la famille Freeling qui, une fois de plus, est la proie des Poltergeist..."
fe63a509-ad1d-4960-b4a9-b704a6aa9ea0,fra,"Vic, treize ans, inscrite au lycée Henri-IV, est à l'âge des premières sorties et des premiers émois. Vic n'a guère l'occasion de parler avec ses parents, trop occupés par leur carrière respective, et dont le couple subit les assauts classiques du temps. Elle se confie donc à son arrière-grand-mère, la pétillante Poupette, ou à sa meilleure amie, Pénélope. Elle partagera donc avec elles son amour pour le beau Mathieu. Mais cet amour-là aussi connaîtra quelques difficultés..."
d765d21d-1675-46ad-a107-13461fc86157,fra,"Dans un futur proche, la terre est surpeuplée. Une loi a été instaurée : il est devenu interdit d'avoir plus d'un enfant. Pour avoir enfreint cette règle car leur premier enfant est mort, le capitaine John Brennick et sa femme, deux commandos bérets noirs, sont incarcérés dans une gigantesque prison souterraine : la Forteresse. S'évader de ce centre carcéral ultra-sophistiqué semble impossible..."
"51fecd44-437f-490e-9bcd-e3a386e95932",fra,"La fille du Grand PDG Bens est tellement malchanceuse qu’elle se fait enlever alors qu’elle est en vacances au Mexique. Pour la retrouver, son père engage le détective privé Campana qu’il associe à un gaffeur invétéré dans l’espoir qu’il le rapproche de sa fille…"
"33569568-7c3e-4baa-84a8-cae15dca2350",fra,"Après le Club Méditerranée, la joyeuse troupe d’amis (plus connue sous le nom des Bronzés) se retrouvent aux sports d’hiver. Ils vivront encore d’autres problèmes sentimentaux et mésaventures. L’équipe ira même se perdre en montagne."
"540ef20e-292e-49ec-b2c4-584501eef931",fra,"JC et Stef sont des amis d'enfance. Inséparables. JC est LE dikkenek belge, un donneur de leçon à cinq balles, un moralisateur, un tombeur de minettes, bref une grande gueule intégrale, coiffé comme un peigne. Stef est tout le contraire. Il cherche le Grand Amour, mais vu qu'il ne bouge pas de son lit, il va avoir du mal à trouver. JC lui explique donc la méthode : faire un sans-faute du point A jusqu'au point G. Entre ces deux points, JC et Stef vont croiser : Claudy, le directeur des abattoirs d'Anderlecht et photographe amateur (de chair fraîche), Greg, un bébé-manager vissé à son portable, Natacha, une nymphette désœuvrée, Fabienne, une pauvre petite fille de riches, Nadine, une institutrice qui préfère la schnouf aux tables de multiplication, ainsi que Laurence, une commissaire de police fâchée avec les conjugaisons, qui ponctue ses phrases à coups de gros calibre."
"6931e7d6-7d10-4454-8101-3a11734fbdfd",fra,Des aventuriers partent à la recherche d'un ancien temple renfermant une grande quantité d'or.
f851fa63-1c5d-473d-9405-375675a20771,fra,"Sur les autoroutes désertées d'une Australie méconnaissable, une guerre sans merci oppose motards hors-la-loi et policiers Interceptor, qui tentent de triompher de la vermine au volant de voitures aux moteurs surgonflés. Dans ce monde en pleine décadence, les bons, les méchants, le manichéisme disparaissent..."
d9e484d0-3dcc-49b8-b4bb-c2babe11b19e,fra,"Ted Masters, un pilote américain est abattu lors d'une mission au Moyen-Orient. Son fils Doug, aidé d'un vétéran de l'US Air Force monte une opération secrète pour le délivrer."
"110d3753-c18e-45b8-9f4d-cf2736abe00a",fra,"Chappy Sinclair, pilote et instructeur chevronné de l'US Air Force, évite la retraite en s'engageant dans la troupe d'un cirque aérien. Ils s'appellent, pour le bonheur des petits et des grands, l'équipe des As. C'est alors qu'un ancien élève de Chappy, d'origine péruvienne, est tué dans le crash de son jet bourré de cocaine. Chappy est persuadé que son élève n'est pas un trafiquant. Les As vont tenter de l'innocenter."
"0e872cc4-c429-428c-8c71-a62fb4c24c96",fra,"Près de la Libye, un pays s'apprête à activer un site de missiles nucléaires capable de frapper à la fois l'Union Soviétique et les Etats-Unis. Charles Sinclair est appelé pour rassembler une force mi-soviétique mi-américaine pour défendre le site. La coopération entre les deux groupes s'opèret difficilement tandis que Chappy Sinclair découvre que quelqu'un du Pentagone s'efforce de saboter sa mission."
fb855bea-eec0-4204-be37-7986abaf6887,fra,"Joe Armstrong, un soldat américain, stationne aux Philippines. Il y affronte une organisation de ninjas, qui vole les armes de l'armée."
"96222ab6-29a3-4043-b5c2-a90a386c0d97",fra,"Après avoir vu son meilleur ami se faire tuer et sa maison détruite, un ex-agent de la CIA reprend du service pour éliminer une redoutable bande de terroristes contrôlée par le machiavélique Rostov."
da9120a9-5384-4692-8032-b7297dcf0250,fra,"Matt Hunter, un ancien agent spécial, fait échouer un attentat contre Larry Richards, l'un de ses amis candidat au sénat, et devient la cible prioritaire d'une organisation terroriste. Ce groupe d'extrême droite, le Pentangle, a établi ses quartiers dans les marais de Louisiane et vise l'élimination de tous les adversaires politiques. Le groupe fait enlever la soeur de Matt et ce dernier est décidé à leur faire payer très cher cette erreur. Rien ni personne ne pourra l'empêcher d'atteindre l'objectif qu'il s'est désormais fixé !"
"0bed1543-84ac-4c53-be68-43299ced4897",fra,"Platoon Leader : Vietnam, années 70: fraichement débarqué des Etats-Unis, le jeune lieutenant Jeff Knight est accueilli avec méfiance et cynisme par les soldats américains du camp de Troug Lam, base stratégique convoitée par les troupes vietcong. Encore inexpérimenté, Knight va faire le dur apprentissage de la guerre au cours d'attaques-surprises et d'affrontements sanglants avec l'ennemi, mais surtout, il va lui falloir gagner le respect de ses hommes..."
a4bd9509-19e3-476d-848d-518ad20b742c,fra,"Lorsque la carrière de sa mère l'entraîne à Benjing en Chine, le jeune Dre Parker doit faire face à des changements radicaux. Au bout de quelques jours, il se retrouve mêlé à une altercation au sein de son école, impliquant Cheng, l'un des garçons les plus doués en Kung Fu et qui lui fait définitivement perdre le respect de ses camarades de classe.Témoin de cet affrontement, M. Han, professeur de Karaté à la retraite, embauché par les Parker comme chauffeur et assistant, décide d'aider Dre à regagner le respect de son entourage."
